,Nombre Entidad,Nit Entidad,Departamento,Ciudad,Localización,Orden,Sector,Rama,Entidad Centralizada,Proceso de Compra,ID Contrato,Referencia del Contrato,Estado Contrato,Codigo de Categoria Principal,Descripcion del Proceso,Tipo de Contrato,Modalidad de Contratacion,Justificacion Modalidad de Contratacion,Fecha de Firma,Fecha de Inicio del Contrato,Fecha de Fin del Contrato,Fecha de Inicio de Ejecucion,Fecha de Fin de Ejecucion,Condiciones de Entrega,TipoDocProveedor,Documento Proveedor,Proveedor Adjudicado,Es Grupo,Es Pyme,Habilita Pago Adelantado,Liquidación,Obligación Ambiental,Obligaciones Postconsumo,Reversion,Origen de los Recursos,Destino Gasto,Valor del Contrato,Valor de pago adelantado,Valor Facturado,Valor Pendiente de Pago,Valor Pagado,Valor Amortizado,Valor Pendiente de Amortizacion,Valor Pendiente de Ejecucion,Estado BPIN,Código BPIN,Anno BPIN,Saldo CDP,Saldo Vigencia,EsPostConflicto,Dias adicionados,Puntos del Acuerdo,Pilares del Acuerdo,URLProceso,Nombre Representante Legal,Nacionalidad Representante Legal,Domicilio Representante Legal,Tipo de Identificación Representante Legal,Identificación Representante Legal,Género Representante Legal,Presupuesto General de la Nacion – PGN,Sistema General de Participaciones,Sistema General de Regalías,"Recursos Propios (Alcaldías, Gobernaciones y Resguardos Indígenas)",Recursos de Credito,Recursos Propios,Ultima Actualizacion,Codigo Entidad,Codigo Proveedor,Fecha Inicio Liquidacion,Fecha Fin Liquidacion,Objeto del Contrato,Duración del contrato,Nombre del banco,Tipo de cuenta,Número de cuenta,El contrato puede ser prorrogado,Fecha de notificación de prorrogación,Nombre ordenador del gasto,Tipo de documento Ordenador del gasto,Número de documento Ordenador del gasto,Nombre supervisor,Tipo de documento supervisor,Número de documento supervisor,Nombre Ordenador de Pago,Tipo de documento Ordenador de Pago,Número de documento Ordenador de Pago,Fecha,exchange_rate,Year,Avg,Valor real,duracion numero,duracion valor,keep,Valor Proyectado,range-,range+,in_range,perc_error,predicterr,Similitud de valor,miles de dolares sobre estimación,Tamaño valor extraño,veces la predicción,Departamento Entidad,Ciudad Entidad
527728,MUNICIPIO DE SACHICA,800019846,Boyacá,Sáchica,"Colombia,  Boyacá ,  Sáchica",Territorial,Servicio Público,Ejecutivo,Descentralizada,CO1.BDOS.6775433,CO1.PCCNTR.6850465,MS RE ESAL 007 2024,terminado,V1.80141607,AUNAR ESFUERZOS ADMINISTRATIVOS; TÉCNICOS; FINANCIEROS Y LOGÍSTICOS PARA PROMOVER Y FOMENTAR MANIFESTACIONES CULTURALES Y ARTISTICAS EN TORNO AL DESARROLLO DEL XXVII FESTIVAL CULTURAL DE LA DANZA DE LA CHICHA QUE SE LLEVARA A CABO EN EL MUNICIPIO DE SÁCHICA; BOYACÁ PARA LA VIGENCIA 2024,Decreto 092 de 2017,Contratación régimen especial (con ofertas),Decreto 092 de 2017,10/03/2024,10/04/2024,10/23/2024,,,A convenir,No Definido,901011895,FUNDATER ESAL,No,Si,No,No,No,No,No,Distribuido,Inversión,449998126,0,0,449998126,0,0,0,449998126,No Válido,No Definido,No D,0,0,No,0,No aplica,No aplica,https://community.secop.gov.co/Public/Tendering/OpportunityDetail/Index?noticeUID=CO1.NTC.6785565&isFromPublicArea=True&isModal=true&asPopupView=true,NANCY RAMIREZ RAMIREZ,CO,No Definido,Sin Descripcion,Sin Descripcion,Hombre,0,212759801,0,237238325,0,0,11/11/2024 12:00:00 AM,703690545,706418530,,,AUNAR ESFUERZOS ADMINISTRATIVOS; TÉCNICOS; FINANCIEROS Y LOGÍSTICOS PARA PROMOVER Y FOMENTAR MANIFESTACIONES CULTURALES Y ARTISTICAS EN TORNO AL DESARROLLO DEL XXVII FESTIVAL CULTURAL DE LA DANZA DE LA CHICHA QUE SE LLEVARA A CABO EN EL MUNICIPIO DE SÁCHICA; BOYACÁ PARA LA VIGENCIA 2024,20 Dia(s),No definido,No Definido,No definido,No,,HECTOR DAVID AMADO SIERRA,Cédula de Ciudadanía,1056482015,HECTOR DAVID AMADO SIERRA,Cédula de Ciudadanía,1056482015,No definido,No definido,No definido,2024,3.9155429850746266,,1,449.9981260000002,20, Dia(s),True,329.43798143975783,644.9642886217944,126.2039451599121,1,0.3659570278853479,-18.07085990905762,0.3291996343254737,30.79014711875125,8296.533071029398,1.3659570278853483,BOYACÁ,SÁCHICA
22614,MUNICIPIO DE SACHICA,800019846,Boyacá,Sáchica,"Colombia,  Boyacá ,  Sáchica",Territorial,Servicio Público,Ejecutivo,Descentralizada,CO1.BDOS.5692897,CO1.PCCNTR.6021353,MS RE ESAL 002 2024,Modificado,V1.94131607,AUNAR ESFUERZOS ADMINISTRATIVOS; TECNICOS Y FINANCIEROS PARA GARANTIZAR EL BIENESTAR DE LOS ADULTOS MAYORES INTERNOS EN CENTROS DE ATENCIÓN INTEGRAL QUE SE ENCUENTRAN EN ESTADO DE ABANDONO Y VULNERABILIDAD DEL MUNICIPIO DE SÁCHICA - BOYACÁ,Decreto 092 de 2017,Contratación régimen especial (con ofertas),Decreto 092 de 2017,02/28/2024,03/01/2024,12/31/2024,,,A convenir,No Definido,900257222,FUNDACION SIN ANIMO DE LUCRO HOGAR GERIATRICO SANTA ROSA DE LIMA,No,No,No,No,No,No,No,Distribuido,Inversión,55587960,0,9115233,55587960,0,0,0,55587960,No Válido,No Definido,No D,41989830,0,No,26,No aplica,No aplica,https://community.secop.gov.co/Public/Tendering/OpportunityDetail/Index?noticeUID=CO1.NTC.5702059&isFromPublicArea=True&isModal=true&asPopupView=true,Orlando Juvenal Gnzález Malagón,CO,No Definido,Cédula de Ciudadanía,19482449,Hombre,0,0,0,55587960,0,0,09/09/2024 12:00:00 AM,703690545,712572833,,,AUNAR ESFUERZOS ADMINISTRATIVOS; TECNICOS Y FINANCIEROS PARA GARANTIZAR EL BIENESTAR DE LOS ADULTOS MAYORES INTERNOS EN CENTROS DE ATENCIÓN INTEGRAL QUE SE ENCUENTRAN EN ESTADO DE ABANDONO Y VULNERABILIDAD DEL MUNICIPIO DE SÁCHICA - BOYACÁ,303 Dia(s),BANCO AGRARIO,Ahorros,415743004367,No,,HECTOR DAVID AMADO SIERRA,Cédula de Ciudadanía,1056482015,HECTOR DAVID AMADO SIERRA,Cédula de Ciudadanía,1056482015,HECTOR DAVID AMADO SIERRA,Cédula de Ciudadanía,1056482015,2024,3.9155429850746266,,1,55.587959999999974,303, Dia(s),True,241.3119160935655,472.4335901375386,92.44385147094728,0,-0.769642706005258,-6.291438102722168,0.05898332858455,-47.432490666432,306.94534164088356,0.23035729399474197,BOYACÁ,SÁCHICA
265960,MUNICIPIO DE SACHICA,800019846,Boyacá,Sáchica,"Colombia,  Boyacá ,  Sáchica",Territorial,Servicio Público,Ejecutivo,Descentralizada,CO1.BDOS.6496802,CO1.PCCNTR.6643771,MS RE ESAL 006 2024,En ejecución,V1.93141500,ANUDAR ESFUERZOS ADMINISTRATIVOS; TECNICOS Y FINANCIEROS PARA GARANTIZAR EL TRATAMIENTO DE REHABILITACIÒN INTEGRAL DE NIÑOS; NIÑAS Y ADULTOS EN SITUACION DE DISCAPACIDAD DEL MUNICIPIO DE SÀCHICA - BOYACÀ,Decreto 092 de 2017,Contratación régimen especial (con ofertas),Decreto 092 de 2017,08/15/2024,08/16/2024,12/16/2024,,,A convenir,No Definido,891801502,FUNDACIÓN DE ASOCIADOS PRO DISCAPACIADOS,No,No,No,No,No,No,No,Distribuido,Inversión,20000000,0,0,20000000,0,0,0,20000000,No Válido,No Definido,No D,20000000,0,No,0,No aplica,No aplica,https://community.secop.gov.co/Public/Tendering/OpportunityDetail/Index?noticeUID=CO1.NTC.6507018&isFromPublicArea=True&isModal=true&asPopupView=true,FUNDACIÓN ASPRODIS,CO,No Definido,NIT,891801502,Mujer,0,12000000,0,8000000,0,0,,703690545,704542539,,,ANUDAR ESFUERZOS ADMINISTRATIVOS; TECNICOS Y FINANCIEROS PARA GARANTIZAR EL TRATAMIENTO DE REHABILITACIÒN INTEGRAL DE NIÑOS; NIÑAS Y ADULTOS EN SITUACION DE DISCAPACIDAD DEL MUNICIPIO DE SÀCHICA - BOYACÀ,4 Mes(es),No definido,No Definido,No definido,No,,HECTOR DAVID AMADO SIERRA,Cédula de Ciudadanía,1056482015,HECTOR DAVID AMADO SIERRA,Cédula de Ciudadanía,1056482015,No definido,No definido,No definido,2024,3.9155429850746266,,1,20.0,4, Mes(es),True,319.6007592302692,625.7052554143027,122.435417175293,0,-0.9374219258797498,-6.403347492218018,0.0112658117357823,-76.51576304290249,109.31851132676535,0.06257807412025013,BOYACÁ,SÁCHICA
91487,MUNICIPIO DE SACHICA,800019846,Boyacá,Sáchica,"Colombia,  Boyacá ,  Sáchica",Territorial,Servicio Público,Ejecutivo,Descentralizada,CO1.BDOS.5781982,CO1.PCCNTR.6085021,MS RE ESAL 004 2024,En ejecución,V1.93141500,AUNAR ESFUERZOS ADMINISTRATIVOS TECNICOS Y FINANCIEROS PARA GARANTIZAR EL TRATAMIENTO DE REAHBILITACION INTEGRAL DE NIÑOS NIÑAS Y ADULTOS EN SITUACION DE DISCAPACIDAD DEL MUNICIPIO DE SÁCHICA  BOYACÁ,Decreto 092 de 2017,Contratación régimen especial (con ofertas),Decreto 092 de 2017,03/14/2024,03/15/2024,05/14/2024,,,A convenir,No Definido,891801502,FUNDACIÓN DE ASOCIADOS PRO DISCAPACIADOS,No,No,No,No,No,No,No,Distribuido,Inversión,12000000,0,12000000,12000000,0,0,0,12000000,No Válido,No Definido,No D,12000000,0,No,0,No aplica,No aplica,https://community.secop.gov.co/Public/Tendering/OpportunityDetail/Index?noticeUID=CO1.NTC.5789577&isFromPublicArea=True&isModal=true&asPopupView=true,FUNDACIÓN ASPRODIS,CO,No Definido,NIT,891801502,Mujer,0,12000000,0,0,0,0,,703690545,704542539,,,AUNAR ESFUERZOS ADMINISTRATIVOS TECNICOS Y FINANCIEROS PARA GARANTIZAR EL TRATAMIENTO DE REAHBILITACION INTEGRAL DE NIÑOS NIÑAS Y ADULTOS EN SITUACION DE DISCAPACIDAD DEL MUNICIPIO DE SÁCHICA  BOYACÁ,60 Mes(es),BBVA COLOMBIA,Corriente,0512000100022021,No,,HECTOR DAVID AMADO SIERRA,Cédula de Ciudadanía,1056482015,HECTOR DAVID AMADO SIERRA,Cédula de Ciudadanía,1056482015,HECTOR DAVID AMADO SIERRA,Cédula de Ciudadanía,1056482015,2024,3.9155429850746266,,1,11.999999999999998,60, Mes(es),True,295.5514411610982,578.6221860835171,113.2223968505859,0,-0.9593979310239292,3.068156003952026,0.0077159059750245,-72.41688885601494,-48.33064721971146,0.04060206897607066,BOYACÁ,SÁCHICA
705323,MUNICIPIO DE SACHICA,800019846,Boyacá,Sáchica,"Colombia,  Boyacá ,  Sáchica",Territorial,Servicio Público,Ejecutivo,Descentralizada,CO1.BDOS.6063221,CO1.PCCNTR.6314890,MS RE ESAL 005 2024,En ejecución,V1.93141500,AUNAR ESFUERZOS ADMINISTRATIVOS TECNICOS FINANCIEROS Y LOGISTICOS ENCAMINADOS A GARANTIZAR LA ATENCIÓN INTEGRAL DE LOS ADULTOS MAYORES EN CONDICIÓN DE VULNERABILIDAD Y DISCAPACIDAD CON EL FIN DE SATISFACER SUS NECESIDADES DE ALIMENTACIÓN SALUD INTERACCIÓN SOCIAL DEPORTE CULTURA RECREACIÓN Y ACTIVIDA,Decreto 092 de 2017,Contratación régimen especial (con ofertas),Decreto 092 de 2017,05/10/2024,05/14/2024,12/28/2024,,,A convenir,No Definido,900697354,fundacion soñando por nuestro mundo,No,Si,No,No,No,No,No,Distribuido,Inversión,254840000,0,0,254840000,0,0,0,254840000,No Válido,No Definido,No D,254840000,0,No,0,No aplica,No aplica,https://community.secop.gov.co/Public/Tendering/OpportunityDetail/Index?noticeUID=CO1.NTC.6070695&isFromPublicArea=True&isModal=true&asPopupView=true,HECTOR ALFONSO AGATON ALVAREZ,CO,CLL 18 11 A 34,Cédula de Ciudadanía,7186559,Hombre,0,0,0,254840000,0,0,,703690545,702662818,,,AUNAR ESFUERZOS ADMINISTRATIVOS TECNICOS FINANCIEROS Y LOGISTICOS ENCAMINADOS A GARANTIZAR LA ATENCIÓN INTEGRAL DE LOS ADULTOS MAYORES EN CONDICIÓN DE VULNERABILIDAD Y DISCAPACIDAD CON EL FIN DE SATISFACER SUS NECESIDADES DE ALIMENTACIÓN SALUD INTERACCIÓN SOCIAL DEPORTE CULTURA RECREACIÓN Y ACTIVIDADES PRODUCTIVAS EN DESARROLLO DEL PROGRAMA DE CENTRO VIDA EN EL MUNICIPIO DE SACHICA - BOYACÁ,225 Dia(s),BANCO CAJA SOCIAL,Ahorros,24068893615,No,,HECTOR DAVID AMADO SIERRA,Cédula de Ciudadanía,1056482015,HECTOR DAVID AMADO SIERRA,Cédula de Ciudadanía,1056482015,HECTOR DAVID AMADO SIERRA,Cédula de Ciudadanía,1056482015,2024,3.9155429850746266,,1,254.83999999999997,225, Dia(s),True,334.5207608373067,654.9152092291715,128.1511001586914,1,-0.2381937690141128,0.8292538523674011,1.306977322680971,-20.34986236673585,-272.028351832865,0.7618062309858872,BOYACÁ,SÁCHICA
274351,MUNICIPIO DE SACHICA,800019846,Boyacá,Sáchica,"Colombia,  Boyacá ,  Sáchica",Territorial,Servicio Público,Ejecutivo,Descentralizada,CO1.BDOS.5699469,CO1.PCCNTR.6021855,MS RE ESAL 003 2024,terminado,otro,AUNAR ESFUERZOS ADMINISTRATIVOS; TÉCNICOS; FINANCIEROS Y LOGÍSTICOS PARA PROMOVER Y FOMENTAR MANIFESTACIONES CULTURALES EN TORNO A LA PRESENTACION Y REALIZACION DE LA OBRA TEATRAL DENOMINADA SEMANA SANTA EN VIVO VERSION 2024 EN EL MUNICIPIO DE SACHICA; QUE PERMITA VALORAR; PRESERVAR; DISFRUTAR Y D,Decreto 092 de 2017,Contratación régimen especial (con ofertas),Decreto 092 de 2017,02/28/2024,03/01/2024,03/31/2024,,,A convenir,No Definido,901021976,Colombia una Realidad,No,Si,No,No,No,No,No,Distribuido,Inversión,150000000,0,0,150000000,0,0,0,150000000,No Válido,No Definido,No D,150000000,0,No,0,No aplica,No aplica,https://community.secop.gov.co/Public/Tendering/OpportunityDetail/Index?noticeUID=CO1.NTC.5708527&isFromPublicArea=True&isModal=true&asPopupView=true,Colombia una Realidad,CO,Calle 10 No. 12-15,NIT,901021976-1,Hombre,0,150000000,0,0,0,0,06/26/2024 12:00:00 AM,703690545,712939776,,,AUNAR ESFUERZOS ADMINISTRATIVOS; TÉCNICOS; FINANCIEROS Y LOGÍSTICOS PARA PROMOVER Y FOMENTAR MANIFESTACIONES CULTURALES EN TORNO A LA PRESENTACION Y REALIZACION DE LA OBRA TEATRAL DENOMINADA SEMANA SANTA EN VIVO VERSION 2024 EN EL MUNICIPIO DE SACHICA; QUE PERMITA VALORAR; PRESERVAR; DISFRUTAR Y DAR A CONOCER ESTE EVENTO COMO PATRIMONIO CULTURAL DEL MUNICIPIO EN EL AMBITO DEPARTAMENTAL; NACIONAL E INTERNACIONAL,1 Mes(es),BANCO AGRARIO DE COLOMBIA,Ahorros,415033038793,No,,HECTOR DAVID AMADO SIERRA,Cédula de Ciudadanía,1056482015,HECTOR DAVID AMADO SIERRA,Cédula de Ciudadanía,1056482015,HECTOR DAVID AMADO SIERRA,Cédula de Ciudadanía,1056482015,2024,3.9155429850746266,,1,150.0,1, Mes(es),True,353.6442832917853,692.354696327447,135.4771041870117,0,-0.5758449744930904,14.71976375579834,0.3163363708181751,-52.00920640331167,-2294.3413095437145,0.4241550255069097,BOYACÁ,SÁCHICA
