,Nombre Entidad,Nit Entidad,Departamento,Ciudad,Localización,Orden,Sector,Rama,Entidad Centralizada,Proceso de Compra,ID Contrato,Referencia del Contrato,Estado Contrato,Codigo de Categoria Principal,Descripcion del Proceso,Tipo de Contrato,Modalidad de Contratacion,Justificacion Modalidad de Contratacion,Fecha de Firma,Fecha de Inicio del Contrato,Fecha de Fin del Contrato,Fecha de Inicio de Ejecucion,Fecha de Fin de Ejecucion,Condiciones de Entrega,TipoDocProveedor,Documento Proveedor,Proveedor Adjudicado,Es Grupo,Es Pyme,Habilita Pago Adelantado,Liquidación,Obligación Ambiental,Obligaciones Postconsumo,Reversion,Origen de los Recursos,Destino Gasto,Valor del Contrato,Valor de pago adelantado,Valor Facturado,Valor Pendiente de Pago,Valor Pagado,Valor Amortizado,Valor Pendiente de Amortizacion,Valor Pendiente de Ejecucion,Estado BPIN,Código BPIN,Anno BPIN,Saldo CDP,Saldo Vigencia,EsPostConflicto,Dias adicionados,Puntos del Acuerdo,Pilares del Acuerdo,URLProceso,Nombre Representante Legal,Nacionalidad Representante Legal,Domicilio Representante Legal,Tipo de Identificación Representante Legal,Identificación Representante Legal,Género Representante Legal,Presupuesto General de la Nacion – PGN,Sistema General de Participaciones,Sistema General de Regalías,"Recursos Propios (Alcaldías, Gobernaciones y Resguardos Indígenas)",Recursos de Credito,Recursos Propios,Ultima Actualizacion,Codigo Entidad,Codigo Proveedor,Fecha Inicio Liquidacion,Fecha Fin Liquidacion,Objeto del Contrato,Duración del contrato,Nombre del banco,Tipo de cuenta,Número de cuenta,El contrato puede ser prorrogado,Fecha de notificación de prorrogación,Nombre ordenador del gasto,Tipo de documento Ordenador del gasto,Número de documento Ordenador del gasto,Nombre supervisor,Tipo de documento supervisor,Número de documento supervisor,Nombre Ordenador de Pago,Tipo de documento Ordenador de Pago,Número de documento Ordenador de Pago,Fecha,exchange_rate,Year,Avg,Valor real,duracion numero,duracion valor,keep,Valor Proyectado,range-,range+,in_range,perc_error,predicterr,Similitud de valor,miles de dolares sobre estimación,Tamaño valor extraño,veces la predicción,Departamento Entidad,Ciudad Entidad
369702,MUNICIPIO DE PANQUEBA,800012628,Boyacá,Panqueba,"Colombia,  Boyacá ,  Panqueba",Territorial,Servicio Público,Ejecutivo,Centralizada,CO1.BDOS.5406997,CO1.PCCNTR.5762275,CO1.PCCNTR.5762275,Modificado,V1.93131600,AUNAR ESFUERZOS TÉCNICOS; ADMINISTRATIVOS Y FINANCIEROS PARA EJECUTAR EL CONVENIO INTERADMINISTRATIVO NÚMERO 3600 DE 2023 SUSCRITO ENTRE EL DEPARTAMENTO DE BOYACÁ Y EL MUNICIPIO DE PANQUEBA PARA AUNAR ESFUERZOS TÉCNICOS; ADMINISTRATIVOS Y FINANCIEROS ENTRE EL DEPARTAMENTO DE BOYACÁ Y EL MUNICIPIO DE,Decreto 092 de 2017,Contratación régimen especial (con ofertas),Decreto 092 de 2017,01/19/2024,01/22/2024,06/16/2024,,,No Definido,No Definido,900893576,FUNDACION ALIMENTANDO UNA NUEVA ESPERANZA,No,No,No,Si,No,No,No,Distribuido,Inversión,169479423,0,0,169479423,0,0,0,169479423,No Válido,No Definido,No D,169479423,0,No,0,No aplica,No aplica,https://community.secop.gov.co/Public/Tendering/OpportunityDetail/Index?noticeUID=CO1.NTC.5419519&isFromPublicArea=True&isModal=true&asPopupView=true,FREDDY ORLANDO MATEUS PUENTES,CO,No Definido,Sin Descripcion,Sin Descripcion,No Definido,0,0,169479423,0,0,0,04/02/2024 12:00:00 AM,710164427,702384025,06/18/2024 12:00:00 AM,10/19/2024 12:00:00 AM,AUNAR ESFUERZOS TÉCNICOS; ADMINISTRATIVOS Y FINANCIEROS PARA EJECUTAR EL CONVENIO INTERADMINISTRATIVO NÚMERO 3600 DE 2023 SUSCRITO ENTRE EL DEPARTAMENTO DE BOYACÁ Y EL MUNICIPIO DE PANQUEBA PARA AUNAR ESFUERZOS TÉCNICOS; ADMINISTRATIVOS Y FINANCIEROS ENTRE EL DEPARTAMENTO DE BOYACÁ Y EL MUNICIPIO DE PANQUEBA; PARA GARANTIZAR EL PROGRAMA DE ALIMENTACIÓN ESCOLAR - PAE; DURANTE EL PRIMER SEMESTRE AÑO 2024,6 Mes(es),BANCOLOMBIA,Ahorros,26249649944,No,,JESUS ALEJANDRO PUENTES MARTINEZ,Cédula de Ciudadanía,4194116,LUIS JESUS SALAZAR MORALES,Cédula de Ciudadanía,7174313,No definido,No definido,No definido,2024,3.9155429850746266,,1,169.479423,6, Mes(es),True,226.11016519099786,442.67203558383835,86.6202335357666,1,-0.2504564186362929,-13.36443424224854,1.269707555503491,-14.46306231520494,2222.5493947805994,0.7495435813637072,BOYACÁ,PANQUEBA
105764,MUNICIPIO DE PANQUEBA,800012628,Boyacá,Panqueba,"Colombia,  Boyacá ,  Panqueba",Territorial,Servicio Público,Ejecutivo,Centralizada,CO1.BDOS.6546660,CO1.PCCNTR.6655918,CO1.PCCNTR.6655918,Activo,V1.93131600,AUNAR ESFUERZOS TECNICOS; ADMINISTRATIVOS Y FINANCIEROS PARA EJECUTAR EL CONVENIO INTERADMINISTRATIVO NUMERO 2673 DE 2024 SUSCRITO ENTRE EL DEPARTAMENTO DE BOYACA Y EL MUNICIPIO DE PANQUEBA PARA AUNAR ESFUERZOS TECNICOS; ADMINISTRATIVOS Y FINANCIEROS ENTRE EL DEPARTAMENTO DE BOYACA Y EL MUNICIPIO DE,Decreto 092 de 2017,Contratación régimen especial (con ofertas),Decreto 092 de 2017,08/16/2024,,12/06/2024,,,No Definido,No Definido,900893576,FUNDACION ALIMENTANDO UNA NUEVA ESPERANZA,No,No,No,Si,No,No,No,Distribuido,Inversión,126376226,0,0,126376226,0,0,0,126376226,No Válido,No Definido,No D,0,0,No,0,No aplica,No aplica,https://community.secop.gov.co/Public/Tendering/OpportunityDetail/Index?noticeUID=CO1.NTC.6558528&isFromPublicArea=True&isModal=true&asPopupView=true,FREDDY ORLANDO MATEUS PUENTES,CO,No Definido,Sin Descripcion,Sin Descripcion,No Definido,0,0,126376226,0,0,0,,710164427,702384025,12/07/2024 12:00:00 AM,04/06/2025 12:00:00 AM,AUNAR ESFUERZOS TECNICOS; ADMINISTRATIVOS Y FINANCIEROS PARA EJECUTAR EL CONVENIO INTERADMINISTRATIVO NUMERO 2673 DE 2024 SUSCRITO ENTRE EL DEPARTAMENTO DE BOYACA Y EL MUNICIPIO DE PANQUEBA PARA AUNAR ESFUERZOS TECNICOS; ADMINISTRATIVOS Y FINANCIEROS ENTRE EL DEPARTAMENTO DE BOYACA Y EL MUNICIPIO DE PANQUEBA PARA GARANTIZAR LA CONTINUIDAD EL PROGRAMA DE ALIMENTACION ESCOLAR - PAE; DURANTE EL SEGUNDO SEMESTRE DEL ANO 2024.,75 Dia(s),No definido,No Definido,No definido,No,,No definido,No definido,No definido,No definido,No definido,No definido,No definido,No definido,No definido,2024,3.9155429850746266,,1,126.37622600000003,75, Dia(s),True,225.67988623450438,441.8296477089767,86.45539855957031,1,-0.4400199853491495,-9.469279289245604,0.6675021958798787,-25.36140213835801,1141.0837144018212,0.5599800146508505,BOYACÁ,PANQUEBA
384538,MUNICIPIO DE PANQUEBA,800012628,Boyacá,Panqueba,"Colombia,  Boyacá ,  Panqueba",Territorial,Servicio Público,Ejecutivo,Centralizada,CO1.BDOS.6455313,CO1.PCCNTR.6583207,CO1.PCCNTR.6583207,Activo,V1.93131600,AUNAR ESFUERZOS TECNICOS; ADMINISTRATIVOS Y FINANCIEROS PARA EJECUTAR EL CONVENIO INTERADMINISTRATIVO NÚMERO 2466 DE 2024 SUSCRITO ENTRE EL DEPARTAMENTO DE BOYACÁ Y EL MUNICIPIO DE PANQUEBA PARA AUNAR ESFUERZOS TECNICOS; ADMINISTRATIVOS Y FINANCIEROS EN LA IMPLEMENTACION Y EJECUCION DEL PROGRAMA DE,Decreto 092 de 2017,Contratación régimen especial (con ofertas),Decreto 092 de 2017,07/30/2024,,08/30/2024,,,A convenir,No Definido,900893576,FUNDACION ALIMENTANDO UNA NUEVA ESPERANZA,No,No,No,No,No,No,No,Distribuido,Inversión,27572994,0,0,27572994,0,0,0,27572994,No Válido,No Definido,No D,0,0,No,0,No aplica,No aplica,https://community.secop.gov.co/Public/Tendering/OpportunityDetail/Index?noticeUID=CO1.NTC.6465437&isFromPublicArea=True&isModal=true&asPopupView=true,FREDDY ORLANDO MATEUS PUENTES,CO,No Definido,Sin Descripcion,Sin Descripcion,No Definido,0,0,27572995,0,0,0,,710164427,702384025,,,AUNAR ESFUERZOS TECNICOS; ADMINISTRATIVOS Y FINANCIEROS PARA EJECUTAR EL CONVENIO INTERADMINISTRATIVO NÚMERO 2466 DE 2024 SUSCRITO ENTRE EL DEPARTAMENTO DE BOYACÁ Y EL MUNICIPIO DE PANQUEBA PARA AUNAR ESFUERZOS TECNICOS; ADMINISTRATIVOS Y FINANCIEROS EN LA IMPLEMENTACION Y EJECUCION DEL PROGRAMA DE ALIMENTACION ESCOLAR PAE; ENTRE EL DEPARTAMENTO DE BOYACA Y EL MUNICIPIO DE PANQUEBA PARA GARANTIZAR LA CONTINUIDAD DEL PROGRAMA DE ALIMENTACION ESCOLAR DURANTE EL SEGUNDO SEMESTRE AÑO 2024,30 Dia(s),No definido,No Definido,No definido,Si,08/29/2024 12:00:00 AM,No definido,No definido,No definido,No definido,No definido,No definido,No definido,No definido,No definido,2024,3.9155429850746266,,1,27.572994,30, Dia(s),True,140.785177464488,275.6252070117812,53.93320083618164,0,-0.8041484586901553,1.103815674781799,0.0427198349359374,-28.91353354976137,-52.608283604437396,0.1958515413098448,BOYACÁ,PANQUEBA
216580,MUNICIPIO DE PANQUEBA,800012628,Boyacá,Panqueba,"Colombia,  Boyacá ,  Panqueba",Territorial,Servicio Público,Ejecutivo,Centralizada,CO1.BDOS.6447372,CO1.PCCNTR.6578783,CO1.PCCNTR.6578783,Activo,V1.93141500,AUNAR ESFUERZOS TÉCNICOS; HUMANOS Y FINANCIEROS PARA EL DESARROLLO DE LAS ACTIVIDADES DE ORGANIZACIÓN; EJECUCIÓN; DIFUSIÓN; LOGÍSTICA Y PROMOCIÓN ARTÍSTICA; EN EL MARCO DE LA CONMEMORACIÓN DEL DÍA DEL CAMPESINO PANQUEBANO; JUEGOS AUTÓCTONOS Y PRIMER CERTAMEN DE GRACIA Y CULTURA EL CÓNGOLO DE ORO PA,Decreto 092 de 2017,Contratación régimen especial (con ofertas),Decreto 092 de 2017,07/30/2024,,08/06/2024,,,A convenir,No Definido,900094981,FUNDACION EL REPIQUE,No,Si,No,Si,No,No,No,Distribuido,Funcionamiento,119999940,0,0,119999940,0,0,0,119999940,No Válido,No Definido,No D,120000000,0,No,0,No aplica,No aplica,https://community.secop.gov.co/Public/Tendering/OpportunityDetail/Index?noticeUID=CO1.NTC.6457594&isFromPublicArea=True&isModal=true&asPopupView=true,DANIELA AVILA RODRIGUEZ,CO,CLL 11 N 18-07,Cédula de Ciudadanía,1007854249,Mujer,0,119999940,0,0,0,0,,710164427,702271792,08/06/2024 12:00:00 AM,12/06/2024 12:00:00 AM,AUNAR ESFUERZOS TÉCNICOS; HUMANOS Y FINANCIEROS PARA EL DESARROLLO DE LAS ACTIVIDADES DE ORGANIZACIÓN; EJECUCIÓN; DIFUSIÓN; LOGÍSTICA Y PROMOCIÓN ARTÍSTICA; EN EL MARCO DE LA CONMEMORACIÓN DEL DÍA DEL CAMPESINO PANQUEBANO; JUEGOS AUTÓCTONOS Y PRIMER CERTAMEN DE GRACIA Y CULTURA EL CÓNGOLO DE ORO PANQUEBA BOYACÁ; VIGENCIA 2024.,10 Dia(s),No definido,No Definido,No definido,No,,JESUS ALEJANDRO PUENTES MARTINEZ,Cédula de Ciudadanía,4194116,LUIS JESUS SALAZAR MORALES,Cédula de Ciudadanía,7174313,JESUS ALEJANDRO PUENTES MARTINEZ,Cédula de Ciudadanía,4194116,2024,3.9155429850746266,,1,119.99994,10, Dia(s),True,181.99212097915196,356.2989863193856,69.71911239624023,1,-0.3406311253785181,14.409423828125,0.9934366797042308,-15.83233314394847,-1770.005709417125,0.6593688746214817,BOYACÁ,PANQUEBA
708600,MUNICIPIO DE PANQUEBA,800012628,Boyacá,Panqueba,"Colombia,  Boyacá ,  Panqueba",Territorial,Servicio Público,Ejecutivo,Centralizada,CO1.BDOS.6472351,CO1.PCCNTR.6612253,CO1.PCCNTR.6612253,Activo,V1.93141500,AUNAR ESFUERZOS TECNICOS; HUMANOS Y FINANCIEROS PARA EL DESARROLLO DE LAS ACTIVIDADES DE ORGANIZACION; EJECUCION; DIFUSION; LOGISTICA Y PROMOCION ARTISTICA; CULTURAL; AGROPECUARIA Y DEPORTIVA EN EL MARCO DE LA REALIZACION DE LAS TRADICIONALES FERIAS Y FIESTAS EN HONOR A LA VIRGEN DEL CARMEN Y VIRGEN,Decreto 092 de 2017,Contratación régimen especial (con ofertas),Decreto 092 de 2017,08/06/2024,,08/20/2024,,,A convenir,No Definido,900094981,FUNDACION EL REPIQUE,No,Si,No,Si,No,No,No,Distribuido,Funcionamiento,120000000,0,0,120000000,0,0,0,120000000,No Válido,No Definido,No D,0,0,No,0,No aplica,No aplica,https://community.secop.gov.co/Public/Tendering/OpportunityDetail/Index?noticeUID=CO1.NTC.6481919&isFromPublicArea=True&isModal=true&asPopupView=true,DANIELA AVILA RODRIGUEZ,CO,CLL 11 N 18-07,Cédula de Ciudadanía,1007854249,Mujer,0,120000000,0,0,0,0,,710164427,702271792,08/20/2024 12:00:00 AM,12/06/2024 12:00:00 AM,AUNAR ESFUERZOS TECNICOS; HUMANOS Y FINANCIEROS PARA EL DESARROLLO DE LAS ACTIVIDADES DE ORGANIZACION; EJECUCION; DIFUSION; LOGISTICA Y PROMOCION ARTISTICA; CULTURAL; AGROPECUARIA Y DEPORTIVA EN EL MARCO DE LA REALIZACION DE LAS TRADICIONALES FERIAS Y FIESTAS EN HONOR A LA VIRGEN DEL CARMEN Y VIRGEN DE LA SALUD; EN EL MUNICIPIO DE PANQUEBA VIGENCIA 2024,15 Dia(s),No definido,No Definido,No definido,No,,JESUS ALEJANDRO PUENTES MARTINEZ,Cédula de Ciudadanía,4194116,LUIS JESUS SALAZAR MORALES,Cédula de Ciudadanía,7174313,JESUS ALEJANDRO PUENTES MARTINEZ,Cédula de Ciudadanía,4194116,2024,3.9155429850746266,,1,119.99999999999999,15, Dia(s),True,169.25691241704345,331.36635804497246,64.84039878845215,1,-0.2910186161004523,17.13369369506836,1.161760388645559,-12.57984208187786,-2090.965477340257,0.7089813838995476,BOYACÁ,PANQUEBA
