,Nombre Entidad,Descripcion del Proceso,Tipo de Contrato,Género Representante Legal,Valor real,Valor Proyectado,Duración del contrato,Tamaño valor extraño,veces la predicción,URLProceso,similarity
742352,GOBERNACIÓN DEL CAUCA,PRESTAR SERVICIOS PROFESIONALES COMO COMUNICADOR SOCIAL PERIODISTA; PARA APOYAR EN EL REGISTRO Y CREACIÓN AUDIOVISUAL DE LAS ACTIVIDADES EXTERNAS QUE REALICE LA GOBERNACIÓN DEL CAUCA.,Prestación de servicios,Mujer,4.799999999999999,30.106746752581333,1 Mes(es),-5.272238906787779,0.15943270255822145,https://community.secop.gov.co/Public/Tendering/OpportunityDetail/Index?noticeUID=CO1.NTC.5688640&isFromPublicArea=True&isModal=true&asPopupView=true,0.31579628586769104
413165,MUNICIPIO DE ENVIGADO,Publicación en medio de comunicación de amplia difusión de la oferta del superávit del fondo de solidaridad y redistribución del ingreso FSRI del servicio de aseo del Municipio de Envigado generado por empresa de naturaleza pública.,Prestación de servicios,Mujer,18.403149999999997,114.03433732553391,2 Mes(es),-5.1964575263220665,0.16138253118851834,https://community.secop.gov.co/Public/Tendering/OpportunityDetail/Index?noticeUID=CO1.NTC.6519143&isFromPublicArea=True&isModal=true&asPopupView=true,0.3183417320251465
424350,RADIO TELEVISION NACIONAL DE COLOMBIA.,"EL CONTRATISTA se obliga con -RTVC- a la prestación de servicios para realizar actividades de periodismo 
digital; construcción y edición de contenidos para las plataformas digitales de RTVC Sistema de Medios Públicos 
y sus marcas.",Prestación de servicios,Hombre,7.7025000000000015,46.8027883975329,39 Dia(s),-5.076311379101966,0.16457352785429386,https://community.secop.gov.co/Public/Tendering/OpportunityDetail/Index?noticeUID=CO1.NTC.7078917&isFromPublicArea=True&isModal=true&asPopupView=true,0.32040834426879883
661621,E.S.E HOSPITAL SAN JOSE DE ISNOS,PRESTACION DE SERVICIOS PARA EL DESARROLLO DE ACTIVIDADES DE COMUNICACIÓN; PUBLICIDAD RADIAL Y EMISION DE PROGRAMA RADIAL,Prestación de servicios,Hombre,3.0,18.199222570446413,3 Mes(es),-5.0664075234821375,0.16484220621993373,https://community.secop.gov.co/Public/Tendering/OpportunityDetail/Index?noticeUID=CO1.NTC.5397148&isFromPublicArea=True&isModal=true&asPopupView=true,0.3847268223762512
448492,DEPARTAMENTO DEL META,FORTALECER LOS PROCEDIMIENTOS DE LA GERENCIA DE INFORMACIÓN Y ESTUDIOS ECONÓMICOS A TRAVÉS DE LA DIFUSIÓN Y COMUNICACIÓN EN MEDIOS DIGITALES,Prestación de servicios,Hombre,12.119333000000001,72.91572900117251,98 Dia(s),-5.0164803625061305,0.16621013279322927,https://community.secop.gov.co/Public/Tendering/OpportunityDetail/Index?noticeUID=CO1.NTC.6693979&isFromPublicArea=True&isModal=true&asPopupView=true,0.3356630504131317
53273,EMPRESA DE SERVICIOS PÚBLICOS DE FUSAGASUGÁ,SERVICIOS PUBLICITARIOS PARA LA PUBLICACIÓN Y DIVULGACIÓN EN UN PERIÓDICO DE AMPLIA CIRCULACIÓN MUNICIPAL Y EN UNA EMISORA FM QUE TRANSMITA EN VIVO Y EN DIRECTO LA CLÁSICA DE CICLISMO DE FUSAGASUGÁ; PARA DAR A CONOCER LAS ACTIVIDADES DESARROLLADAS POR EMERFUSA ENMARCADAS EN EL PLAN DE ACCIÓN 2024,Decreto 092 de 2017,No Definido,7.4,44.215274812648246,8 Mes(es),-4.9750371368443576,0.16736297651333726,https://community.secop.gov.co/Public/Tendering/OpportunityDetail/Index?noticeUID=CO1.NTC.6142083&isFromPublicArea=True&isModal=true&asPopupView=true,0.32222071290016174
109908,ESE HOSPITAL SALAZAR DE VILLETA,PRESTACIÓN DE SERVICIOS DE PUBLICIDAD Y PROPAGANDA A TRAVÉS DE REDES SOCIALES E INTERNET DE LA INFORMACIÓN INSTITUCIONAL DEL HOSPITAL SALAZAR DE VILLETA E.S.E.,Prestación de servicios,Hombre,5.000000000000001,29.583316086231182,24 Dia(s),-4.916663217246236,0.1690141830424185,https://community.secop.gov.co/Public/Tendering/OpportunityDetail/Index?noticeUID=CO1.NTC.7159581&isFromPublicArea=True&isModal=true&asPopupView=true,0.3646509051322937
391631,ESE HOSPITAL SALAZAR DE VILLETA,PRESTACIÓN DE SERVICIOS DE PUBLICIDAD Y PROPAGANDA A TRAVÉS DE REDES SOCIALES E INTERNET DE LA INFORMACIÓN INSTITUCIONAL DEL HOSPITAL SALAZAR DE VILLETA E.S.E,Prestación de servicios,Hombre,6.749999999999999,39.807175201536616,135 Dia(s),-4.897359289116537,0.16956742009012082,https://community.secop.gov.co/Public/Tendering/OpportunityDetail/Index?noticeUID=CO1.NTC.5457104&isFromPublicArea=True&isModal=true&asPopupView=true,0.36007362604141235
664059,GOBERNACIÓN DE RISARALDA,PRESTACIÓN DE SERVICIOS DE APOYO PARA DIVULGACION Y PROMOCION DEL CARTEL DE LOS MAS BUSCADOS Y LAS DIFERENTESESTRATEGIAS DEL PISCC (2024 2027) SEGURIDAD EQUITATIVA E INCLUSIVA; A TRAVÉS DE PUBLICACIONES EN MEDIOS MASIVOS DE COMUNICACIÓN RADIALES; TELEVISIVOS DE PRENSA Y DIGITALES CON AMPLIA COBERTUR,Prestación de servicios,Hombre,5.000000000000001,29.4820240232508,60 Dia(s),-4.896404804650159,0.16959486892951395,https://community.secop.gov.co/Public/Tendering/OpportunityDetail/Index?noticeUID=CO1.NTC.6956402&isFromPublicArea=True&isModal=true&asPopupView=true,0.3479729890823364
242207,ESE HOSPITAL DEPARTAMENTAL SAN RAFAEL,PRESTACION DE SERVICIOS PROFESIONALES DE MANEJO DE LAS TELECOMUNICACIONES; MARKETING DIGITAL Y DIFUSION DE PUBLICIDAD DE TODOS LOS ACONTECIMIENTOS DEL HOSPITAL SAN RAFAEL DE FUNDACION ; EN LOS DIFERENTES MEDIOS DE COMUNICACION INTERNET; DISPOSITIVOS MOVILES; REDES SOCIALES; MOTORES DE BUSQUEDA; PUBL,Decreto 092 de 2017,Hombre,4.499999999999999,26.312350261431142,1 Mes(es),-4.8471889469847,0.1710223509222639,https://community.secop.gov.co/Public/Tendering/OpportunityDetail/Index?noticeUID=CO1.NTC.5625503&isFromPublicArea=True&isModal=true&asPopupView=true,0.304435670375824
878872,ESE HOSPITAL DEPARTAMENTAL SAN RAFAEL,PRESTACION DE SERVICIOS PROFESIONALES DE MANEJO DE LAS TELECOMUNICACIONES; MARKETING DIGITAL Y DIFUSION DE PUBLICIDAD DE TODOS LOS ACONTECIMIENTOS DEL HOSPITAL SAN RAFAEL DE FUNDACION ; EN LOS DIFERENTES MEDIOS DE COMUNICACION INTERNET; DISPOSITIVOS MOVILES; REDES SOCIALES; MOTORES DE BUSQUEDA; PUBL,Decreto 092 de 2017,Hombre,4.499999999999999,26.312350261431142,1 Mes(es),-4.8471889469847,0.1710223509222639,https://community.secop.gov.co/Public/Tendering/OpportunityDetail/Index?noticeUID=CO1.NTC.5402892&isFromPublicArea=True&isModal=true&asPopupView=true,0.304435670375824
646064,ALCALDIA MUNICIPIO DE RICAURTE,PRESTAR LOS SERVICIOS DE APOYO A LA GESTIÓN EN LA DIRECCIÓN DE COMUNICACIONES DIRIGIDO A LA PROMOCIÓN DIVULGACION Y/O DIFUSION DE MENSAJES Y PAUTAS PUBLICITARIAS DE LAS CAMPAÑAS Y EVENTOS INSTITUCIONALES PROMOVIDAS POR LAS DIFERENTES DEPENDENCIAS DE LA ADMINISTRACION MUNICIPAL EN EL PROGRAMA NOTI 8,Prestación de servicios,Hombre,2.0,11.683782059560325,2 Mes(es),-4.841891029780163,0.17117744834717177,https://community.secop.gov.co/Public/Tendering/OpportunityDetail/Index?noticeUID=CO1.NTC.6252157&isFromPublicArea=True&isModal=true&asPopupView=true,0.30489015579223633
806460,LOTERIA DE BOYCA,ESPACIO PUBLICITARIO EN SERVICIO DE PERIFONEO CON VALLA MOVIL PARA PROMOCIONAR LOS PRODUCTOS Y/O CAMPAÑAS PUBLICITARIAS DE LA LOTERÍA DE BOYACÁ,Prestación de servicios,Mujer,7.5,43.65770850980508,5 Mes(es),-4.821027801307344,0.17179096787261694,https://community.secop.gov.co/Public/Tendering/OpportunityDetail/Index?noticeUID=CO1.NTC.6082687&isFromPublicArea=True&isModal=true&asPopupView=true,0.33702850341796875
76835,ASAMBLEA DEPARTAMENTAL DE BOYACÁ,PRESTACION DE SERVICIOS DE APOYO A LA GESTIÓN PARA REALIZAR LA PRODUCCIÓN Y EDICIÓN DE MATERIAL AUDIOVISUAL NECESARIO PARA LA PROMOCIÓN; SOCIALIZACIÓN Y DIVULGACIÓN EN MEDIOS MASIVOS Y REDES SOCIALES DE LA LABOR ADMINISTRATIVA DE LA ASAMBLEA DEPARTAMENTAL DE BOYACÁ.,Prestación de servicios,Mujer,4.35,25.156168632510077,45 Dia(s),-4.783027271841398,0.172919813964769,https://community.secop.gov.co/Public/Tendering/OpportunityDetail/Index?noticeUID=CO1.NTC.6137550&isFromPublicArea=True&isModal=true&asPopupView=true,0.3233974277973175
647473,RADIO TELEVISION NACIONAL DE COLOMBIA.,EL CONTRATISTA SE OBLIGA CON -RTVC-A LA PRESTACIÓN DE SERVICIOS PARA REALIZAR ACTIVIDADES DE REALIZACIÓN; EDICIÓN Y DIVULGACIÓN DE CONTENIDOS DIGITALES PARA RTVC SISTEMA DE MEDIOS PÚBLICOS Y SUS MARCAS.,Prestación de servicios,Hombre,7.379432999999999,42.2236434766685,45 Dia(s),-4.721800506443857,0.17477016174782853,https://community.secop.gov.co/Public/Tendering/OpportunityDetail/Index?noticeUID=CO1.NTC.7052025&isFromPublicArea=True&isModal=true&asPopupView=true,0.3312200903892517
633378,RADIO TELEVISION NACIONAL DE COLOMBIA.,EL CONTRATISTA SE OBLIGA CON -RTVC-A LA PRESTACIÓN DE SERVICIOS PARA REALIZAR ACTIVIDADES DE REALIZACIÓN; EDICIÓN Y DIVULGACIÓN DE CONTENIDOS DIGITALES PARA RTVC SISTEMA DE MEDIOS PÚBLICOS Y SUS MARCAS.,Prestación de servicios,Hombre,7.379432999999999,42.2236434766685,45 Dia(s),-4.721800506443857,0.17477016174782853,https://community.secop.gov.co/Public/Tendering/OpportunityDetail/Index?noticeUID=CO1.NTC.7052038&isFromPublicArea=True&isModal=true&asPopupView=true,0.3312200903892517
318469,RADIO TELEVISION NACIONAL DE COLOMBIA.,EL CONTRATISTA se obliga a prestar sus servicios desarrollando actividades de registro audiovisual y/o reportería para los contenidos audiovisuales y/o transmisiones de RTVC.,Prestación de servicios,Hombre,6.102478,34.7493028831428,39 Dia(s),-4.694293839837326,0.17561440068371462,https://community.secop.gov.co/Public/Tendering/OpportunityDetail/Index?noticeUID=CO1.NTC.7085083&isFromPublicArea=True&isModal=true&asPopupView=true,0.35141921043395996
708397,RADIO TELEVISION NACIONAL DE COLOMBIA.,EL CONTRATISTA SE OBLIGA A PRESTAR SUS SERVICIOS DESARROLLANDO ACTIVIDADES DE REGISTRO AUDIOVISUAL Y/O REPORTERÍA PARA LOS CONTENIDOS AUDIOVISUALES Y/O TRANSMISIONES DE RTVC.,Prestación de servicios,No Definido,6.102478,34.7493028831428,39 Dia(s),-4.694293839837326,0.17561440068371462,https://community.secop.gov.co/Public/Tendering/OpportunityDetail/Index?noticeUID=CO1.NTC.7089265&isFromPublicArea=True&isModal=true&asPopupView=true,0.35141921043395996
401562,RADIO TELEVISION NACIONAL DE COLOMBIA.,EL CONTRATISTA se obliga a prestar sus servicios desarrollando actividades de registro audiovisual y/o reportería para los contenidos audiovisuales y/o transmisiones de RTVC.,Prestación de servicios,Hombre,6.102478,34.7493028831428,39 Dia(s),-4.694293839837326,0.17561440068371462,https://community.secop.gov.co/Public/Tendering/OpportunityDetail/Index?noticeUID=CO1.NTC.7085264&isFromPublicArea=True&isModal=true&asPopupView=true,0.35141921043395996
339732,RADIO TELEVISION NACIONAL DE COLOMBIA.,EL CONTRATISTA SE OBLIGA A PRESTAR SUS SERVICIOS DESARROLLANDO ACTIVIDADES DE REGISTRO AUDIOVISUAL Y/O REPORTERÍA PARA LOS CONTENIDOS AUDIOVISUALES Y/O TRANSMISIONES DE RTVC.,Prestación de servicios,No Definido,6.102578000000001,34.7493028831428,39 Dia(s),-4.694200530192781,0.1756172784392868,https://community.secop.gov.co/Public/Tendering/OpportunityDetail/Index?noticeUID=CO1.NTC.7094723&isFromPublicArea=True&isModal=true&asPopupView=true,0.35141921043395996
163689,LOTERIA DE BOYCA,PUBLICIDAD EN EL FESTIVAL DE MUSICA ANDINA COLOMBIANA MONO NUÑEZ PARA PROMOCIONAR LOS PRODUCTOS Y/O CAMPAÑAS PUBLICITARIAS DE LA LOTERIA DE BOYACÁ,Prestación de servicios,No Definido,5.000000000000001,28.396813828303305,4 Dia(s),-4.6793627656606605,0.17607609185423703,https://community.secop.gov.co/Public/Tendering/OpportunityDetail/Index?noticeUID=CO1.NTC.6205016&isFromPublicArea=True&isModal=true&asPopupView=true,0.3044239580631256
361407,RADIO TELEVISION NACIONAL DE COLOMBIA.,EL CONTRATISTA SE OBLIGA A PRESTAR SUS SERVICIOS DESARROLLANDO ACTIVIDADES DE REGISTRO AUDIOVISUAL Y/O REPORTERÍA PARA LOS CONTENIDOS AUDIOVISUALES Y/O TRANSMISIONES DE RTVC,Prestación de servicios,No Definido,6.258952,35.50173807477848,40 Dia(s),-4.672153752701488,0.17629987542628373,https://community.secop.gov.co/Public/Tendering/OpportunityDetail/Index?noticeUID=CO1.NTC.7087822&isFromPublicArea=True&isModal=true&asPopupView=true,0.3458944261074066
206351,RADIO TELEVISION NACIONAL DE COLOMBIA.,El CONTRATISTA se obliga a prestar sus servicios desarrollando actividades de registro audiovisual y/o reportería para los contenidos audiovisuales y/o transmisiones de RTVC,Prestación de servicios,Hombre,6.258952,35.50173807477848,39 Dia(s),-4.672153752701488,0.17629987542628373,https://community.secop.gov.co/Public/Tendering/OpportunityDetail/Index?noticeUID=CO1.NTC.7087153&isFromPublicArea=True&isModal=true&asPopupView=true,0.3458944261074066
771637,DIRECCION DE TRANSITO DE BUCARAMANGA,"PRESTAR SERVICIOS DE APOYO A LA GESTIÓN EN EL DISEÑO; 
COSTRUCCIÓN DE PIEZAS GRÁFICAS Y EDICIÓN DE PRODUCTO 
AUDIOVISUAL DE CARÁCTER EDUCATIVO; INFORMATIVO Y 
PUBLICITARIO DEL GRUPO DE COMUNICACIÓN Y PRENSA DE LA 
 DIRECCIÓN DE TRÁNSITO DE BUCARAMANGA",Prestación de servicios,Hombre,4.666665999999998,26.423474407801905,45 Dia(s),-4.66217389626811,0.17661061251740987,https://community.secop.gov.co/Public/Tendering/OpportunityDetail/Index?noticeUID=CO1.NTC.7041992&isFromPublicArea=True&isModal=true&asPopupView=true,0.3646281361579895
617021,MUNICIPIO DE ARMENIA QUINDIO,PRESTACION DE SERVICIOS PROFESIONALES PARA LA PRODUCCION DE CONTENIDO PERIODISTICO Y/O CORPORATIVO Y PRODUCCION AUDIOVISUAL PARA LOS DIFERENTES MEDIOS DE COMUNICACIÓN INTERNA Y EXTERNA DEL MUNICIPIO DE ARMENIA.,Prestación de servicios,Mujer,4.053332999999999,22.86529531057567,38 Dia(s),-4.64110950434511,0.1772700918551115,https://community.secop.gov.co/Public/Tendering/OpportunityDetail/Index?noticeUID=CO1.NTC.7050048&isFromPublicArea=True&isModal=true&asPopupView=true,0.30297785997390747
703134,ALCALDIA MUNICIPIO DE RICAURTE,PRESTAR LOS SERVICIOS DE APOYO A LA GESTIÓN EN LA COMUNICACIÓN Y PUBLICIDAD DE CONTENIDOS INSTITUCIONALES PARA SER TRANSMITIDOS EN REDES SOCIALES DE LOS PROYECTOS DE LA ALCALDÍA MUNICIPAL DE RICAURTE - CUNDINAMARCA,Prestación de servicios,Hombre,3.1999999999999997,17.962890384220334,4 Mes(es),-4.613403245068855,0.17814504968593858,https://community.secop.gov.co/Public/Tendering/OpportunityDetail/Index?noticeUID=CO1.NTC.6636629&isFromPublicArea=True&isModal=true&asPopupView=true,0.3165421783924103
619824,LOTERIA DE BOYCA,"COMPRA DE ESPACIO PUBLICITARIO PARA LA DIFUSION 
DE CUÑAS RADIALES DE LOS PRODUCTOS Y/O CAMPAÑAS 
PUBLICITARIAS DE LA LOTERÍA DE BOYACÁ DEL AÑO 
2024; A TRAVÉS DE LA EMISORA VIVA FM STEREO 89.6 
DENTRO DEL ESPACIO INFORMATIVO CONTACTO 
DIRECTO",Compraventa,Hombre,6.000000000000002,33.361468006375254,5 Mes(es),-4.560244667729208,0.1798482008901234,https://community.secop.gov.co/Public/Tendering/OpportunityDetail/Index?noticeUID=CO1.NTC.6095328&isFromPublicArea=True&isModal=true&asPopupView=true,0.37841105461120605
43462,Secretaría Privada - Alcaldía de Tuluá,PRESTACIÓN DE SERVICIOS PARA LA PROMOCIÓN DE LA INFORMACIÓN Y LA PARTICIPACIÓN CIUDADANA; A TRAVÉS DE LA EDICIÓN Y PRODUCCIÓN DE MEDIOS AUDIOVISUALES EN EL MUNICIPIO DE TULUA.,Prestación de servicios,Hombre,10.500000000000002,58.33982744486156,3 Mes(es),-4.5561740423677675,0.17997996325792728,https://community.secop.gov.co/Public/Tendering/OpportunityDetail/Index?noticeUID=CO1.NTC.5784391&isFromPublicArea=True&isModal=true&asPopupView=true,0.30266231298446655
393817,RADIO TELEVISION NACIONAL DE COLOMBIA.,"El CONTRATISTA se obliga a prestar sus servicios desarrollando actividades de registro audiovisual y/o
reportería para los contenidos audiovisuales y/o transmisiones de RTVC.",Prestación de servicios,Hombre,6.258952,34.7493028831428,40 Dia(s),-4.55193631188461,0.18011733993766746,https://community.secop.gov.co/Public/Tendering/OpportunityDetail/Index?noticeUID=CO1.NTC.7056727&isFromPublicArea=True&isModal=true&asPopupView=true,0.35141921043395996
549761,MUNICIPIO DE ARMENIA QUINDIO,PRESTAR SERVICIOS DE APOYO A LA GESTIÓN PARA REALIZAR ACOMPAÑAMIENTO A LA PRODUCCIÓN DE CONTENIDOS AUDIOVISUALES DE MEDIOS INSTITUCIONALES; CREACIÓN DE CAMPAÑAS PUBLICITARIAS EN ESPACIOS FÍSICOS; EN MEDIOS Y REDES SOCIALES INSTITUCIONALES DEL MUNICIPIO DE ARMENIA.,Prestación de servicios,Hombre,2.166667,12.007549630296909,26 Dia(s),-4.541945130607015,0.1804420607626025,https://community.secop.gov.co/Public/Tendering/OpportunityDetail/Index?noticeUID=CO1.NTC.7105447&isFromPublicArea=True&isModal=true&asPopupView=true,0.35704970359802246
