,Nombre Entidad,Descripcion del Proceso,Tipo de Contrato,Género Representante Legal,Valor real,Valor Proyectado,Duración del contrato,Tamaño valor extraño,veces la predicción,URLProceso,similarity
724933,ALCALDÍA DE POPAYÁN,"PRESTAR SERVICIOS PROFESIONALES ESPECIALIZADOS PARA APOYAR LA DIVULGACIÓN DE
PROGRAMAS SOCIALES EN EL MARCO DE LA ESTRATEGIA DE PRENSA Y COMUNICACIONES.",Prestación de servicios,Mujer,14.8,41.26770128439124,89 Dia(s),-1.7883581948912997,0.35863398104022415,https://community.secop.gov.co/Public/Tendering/OpportunityDetail/Index?noticeUID=CO1.NTC.5841517&isFromPublicArea=True&isModal=true&asPopupView=true,0.30519670248031616
739831,MUNICIPIO DE PEREIRA- OFICIAL,PRESTACIÓN DE SERVICIOS PROFESIONALES COMO LICENCIADA EN COMUNICACIÓN PARA DEFINIR ESTRETEGIAS COMUNICACIONALES RESPECTO AL PROCESAMIENTO DE INFORMACION PARA LA GENERACION DE CONTENIDOS AUDIOVISUALES A EMITIR A TRAVES DE LAS DIFERENTES REDES SOCIALES DE LA ADMINISTRACIÓN MUNICIPAL,Prestación de servicios,Mujer,10.799999999999999,29.987099323734924,90 Dia(s),-1.776583270716197,0.36015487471479946,https://community.secop.gov.co/Public/Tendering/OpportunityDetail/Index?noticeUID=CO1.NTC.6778873&isFromPublicArea=True&isModal=true&asPopupView=true,0.3372257947921753
433081,EMPRESA DE SERVICIOS PUBLICOS DE HERVEO S.A.E.S.P EMPOHERVEO S.A.E.S.P,PRESTACIÓN DE SERVICIOS  COMO COORDINADOR DE PRENSA Y MEDIOS DIGITALES; CON EL FIN DE HACER VISIBLES A TRAVÉS DE ESTRATEGIAS AUDIOVISUALES DIGITALES Y COMUNICATIVAS; LA TOTALIDAD DE LOS PROCESOS ADMINISTRATIVOS Y DE GESTION POR PARTE DE LA EMPRESA DE SERVICIOS PUBLICOS DE HERVEO  EMPOHERVEO.   CONTR,Prestación de servicios,Mujer,8.799999999999999,24.295986272062404,4 Mes(es),-1.7609075309161826,0.3621997436720233,https://community.secop.gov.co/Public/Tendering/OpportunityDetail/Index?noticeUID=CO1.NTC.6652038&isFromPublicArea=True&isModal=true&asPopupView=true,0.31505152583122253
61958,EMPRESA INDUSTRIAL Y COMERCIAL DEL ESTADO ADMINISTRADORA DEL MONOPOLIO RENTISTICO DE LOS JUEGOS DE SUERTE Y AZAR,Prestar servicios profesionales para el desarrollo gráfico para la divulgación y difusión de campañas comunicativas que promocionen la estrategia de comunicaciones de Coljuegos y promover el juego legal,Decreto 092 de 2017,No Definido,41.976000000000006,115.61415860698146,198 Dia(s),-1.754291943181376,0.36306971832656876,https://community.secop.gov.co/Public/Tendering/OpportunityDetail/Index?noticeUID=CO1.NTC.5641794&isFromPublicArea=True&isModal=true&asPopupView=true,0.3140329122543335
640127,TRANSMILENIO S.A.,SAUCC186 Contratar la prestación de servicios profesionales para la edición audiovisuales de contenidos digitales en diferentes formatos para las redes sociales y página web de TRANSMILENIO S.A.,Prestación de servicios,No Definido,11.805499999999999,32.398664715030186,105 Dia(s),-1.7443703964279522,0.36438230105586,https://community.secop.gov.co/Public/Tendering/OpportunityDetail/Index?noticeUID=CO1.NTC.7212014&isFromPublicArea=True&isModal=true&asPopupView=true,0.3206365704536438
200821,LA GUAJIRA - ALCALDÍA MUNICIPIO DE MAICAO,PRESTACIÓN DE SERVICIOS PROFESIONALES PARA LA ARTICULACIÓN Y MEDIACIÓN CON LA FUERZA PÚBLICA PARA LA REALIZACIÓN DE ACCIONES DE SEGURIDAD; ORDEN PÚBLICO Y CONVIVENCIA CIUDADANA.,Prestación de servicios,Hombre,11.999999999999998,32.92774106574566,72 Dia(s),-1.7439784221454717,0.36443435266452145,https://community.secop.gov.co/Public/Tendering/OpportunityDetail/Index?noticeUID=CO1.NTC.6909263&isFromPublicArea=True&isModal=true&asPopupView=true,0.31114473938941956
773575,RNEC,Prestación de servicios para la publicación de artículo en la revista Semana; contenido digital y distribución en las redes sociales y en https://www.semana.com de la audiencia de rendición de cuentas correspondiente a la vigencia 2024 de la Registraduría Nacional del Estado Civil; de conformidad co,Prestación de servicios,Mujer,16.659999999999997,45.631470310946575,9 Dia(s),-1.7389838121816676,0.3650989084172336,https://community.secop.gov.co/Public/Tendering/OpportunityDetail/Index?noticeUID=CO1.NTC.7230677&isFromPublicArea=True&isModal=true&asPopupView=true,0.31987348198890686
644483,LOTERIA DE BOYCA,ESPACIO PUBLICITARIO EN LA PAGINA WEB WWW.RADIO.VOZMINERA.COM; PARA PROMOCIONAR LOS PRODUCTOS Y/O CAMPAÑAS PUBLICITARIAS,Prestación de servicios,Hombre,7.5,20.51989813165583,5 Mes(es),-1.7359864175541104,0.36549889048571005,https://community.secop.gov.co/Public/Tendering/OpportunityDetail/Index?noticeUID=CO1.NTC.6090683&isFromPublicArea=True&isModal=true&asPopupView=true,0.38500216603279114
565453,GOBERNACIÓN DE RISARALDA,PRESTACIÓN DE SERVICIOS PROFESIONALES COMO COMUNICADOR SOCIAL- PERIODISTA PARA REALIZAR CONTENIDOS PERIODISTICOS; ENTREVISTAS; REPORTAJES RADIALES Y LOCUTANDO PARA LA EMISORA INSTITUCIONAL.,Prestación de servicios,No Definido,8.038848,21.984534760273924,67 Dia(s),-1.7347867207184318,0.3656592276187807,https://community.secop.gov.co/Public/Tendering/OpportunityDetail/Index?noticeUID=CO1.NTC.6879344&isFromPublicArea=True&isModal=true&asPopupView=true,0.341947466135025
