,Nombre Entidad,Descripcion del Proceso,Tipo de Contrato,Género Representante Legal,Valor real,Valor Proyectado,Duración del contrato,Tamaño valor extraño,veces la predicción,URLProceso,similarity
149549,MUNICIPIO DE ENVIGADO,PRESTACIÓN DE SERVICIOS PROFESIONALES EN COMUNICACIÓN PARA EL POSICIONAMIENTO Y LA REDACCIÓN EN MEDIOS PUBLICITARIOS DE LOS EVENTOS; PROGRAMAS Y CAMPAÑAS DE LA SECRETARÍA DE SEGURIDAD,Prestación de servicios,Hombre,30.153658,26.306790719468793,206 Dia(s),0.12757547626663426,1.1462309607262078,https://community.secop.gov.co/Public/Tendering/OpportunityDetail/Index?noticeUID=CO1.NTC.6168309&isFromPublicArea=True&isModal=true&asPopupView=true,0.31286051869392395
627852,RADIO TELEVISION NACIONAL DE COLOMBIA.,EL CONTRATISTA se obliga a prestar sus servicios desarrollando actividades de periodismo y de presentación para los contenidos audiovisuales de RTVC.,Prestación de servicios,No Definido,26.033333,22.581837217903132,110 Dia(s),0.13257986528643362,1.1528438872706284,https://community.secop.gov.co/Public/Tendering/OpportunityDetail/Index?noticeUID=CO1.NTC.6694192&isFromPublicArea=True&isModal=true&asPopupView=true,0.3224610686302185
164594,GOBERNACIÓN DEL CAUCA,"PRESTAR SERVICIOS PROFESIONALES COMO COMUNICADOR SOCIAL; PARA APOYO EN EL
SEGUIMIENTO DE LAS ESTRATEGIAS DE COMUNICACIÓN EXTERNA E INTERNA CON EJERCICIOS DE PERIODISMO;
REPORTERÍA; REDACCIÓN DE TEXTOS Y CREACIÓN AUDIOVISUAL DE LAS ACTIVIDADES QUE REALICE LA GOBERNACIÓN
DEL CAUCA; EN EL MARCO DEL PRO",Prestación de servicios,No Definido,30.725499999999997,26.382540388745575,195 Dia(s),0.14134707689881115,1.1646149137748338,https://community.secop.gov.co/Public/Tendering/OpportunityDetail/Index?noticeUID=CO1.NTC.6141098&isFromPublicArea=True&isModal=true&asPopupView=true,0.3203274607658386
823993,MUNICIPIO DE TENJO,PRESTACIÓN DE SERVICIOS PROFESIONALES COMO COMUNICADOR SOCIAL Y PERIODISTA PARA EL FORTALECIMIENTO DE LA OFICINA DE PRENSA Y COMUNICACIONES; EN LA PRESENTACIÓN DE EVENTOS PROTOCOLARIOS; REALIZACIÓN DE CONTENIDO AUDIOVISUAL Y MULTIMEDIA DE LA ALCALDÍA DEL MUNICIPIO DE TENJO.,Prestación de servicios,Hombre,28.383332999999997,24.30544957188013,131 Dia(s),0.14367176075198318,1.1677765069129897,https://community.secop.gov.co/Public/Tendering/OpportunityDetail/Index?noticeUID=CO1.NTC.6566010&isFromPublicArea=True&isModal=true&asPopupView=true,0.3935464024543762
429407,MUNICIPIO DE BUCARAMANGA,PRESTAR SERVICIOS LOS SERVICIOS PROFESIONALES COMO COMUNICADOR SOCIAL PERIODISTA EN EL MARCO DEL PROYECTO: IMPLEMENTACIÓN DE ESTRATEGIAS DE COMUNICACIÓN Y PUBLICIDAD EN LA ALCALDIA DE BUCARAMANGA,Prestación de servicios,Hombre,29.999999999999996,25.57117154976218,5 Mes(es),0.14762761500792723,1.1731961494849463,https://community.secop.gov.co/Public/Tendering/OpportunityDetail/Index?noticeUID=CO1.NTC.6425923&isFromPublicArea=True&isModal=true&asPopupView=true,0.3179208040237427
679012,SUPERSOCIEDADES,PRESTAR LOS SERVICIOS DE PREPRODUCCIÓN; PRODUCCIÓN; REALIZACIÓN DE MATERIAL AUDIOVISUAL; CONTENIDOS DIGITALES; CONVERGENTES; MULTIPLATAFORMA Y MULTIMEDIA PARA DIFUNDIR LAS ACCIONES MISIONALES REALIZADAS POR LA ENTIDAD A NIVEL NACIONAL Y LA TRANSMISIÓN EN DIRECTO CON LA INTERPRETACIÓN EN LENGUAJE DE,Prestación de servicios,No Definido,99.53615900000001,84.76056394512469,60 Dia(s),0.14844449698802747,1.174321575590758,https://community.secop.gov.co/Public/Tendering/OpportunityDetail/Index?noticeUID=CO1.NTC.6896077&isFromPublicArea=True&isModal=true&asPopupView=true,0.30971065163612366
792745,CONCEJO MUNICIPAL DE SAN JOSE DE CÚCUTA.,PRESTAR DE MANERA AUTÓNOMA E INDEPENDIENTE LOS SERVICIOS PROFESIONALES COMO COMUNICADOR(A) SOCIAL EN EL DESARROLLO DE ACTIVIDADES DE DIVULGACIÓN; COMUNICACIÓN Y PRENSA DE LA CORPORACIÓN CONCEJO MUNICIPAL DE CÚCUTA,Prestación de servicios,Mujer,18.0,15.296637493592506,6 Mes(es),0.15018680591152744,1.1767291999656713,https://community.secop.gov.co/Public/Tendering/OpportunityDetail/Index?noticeUID=CO1.NTC.5833400&isFromPublicArea=True&isModal=true&asPopupView=true,0.3304309844970703
51876,RADIO TELEVISION NACIONAL DE COLOMBIA.,El CONTRATISTA se obliga a prestar sus servicios de corresponsalía en la ciudad de Cartagena; Bolívar; desarrollando actividades de registro audiovisual o reportería de forma transversal para el servicio informativo de RTVC.,Prestación de servicios,Hombre,47.351365000000015,40.19252549774825,164 Dia(s),0.15118549385538863,1.1781137018287848,https://community.secop.gov.co/Public/Tendering/OpportunityDetail/Index?noticeUID=CO1.NTC.6625985&isFromPublicArea=True&isModal=true&asPopupView=true,0.30210021138191223
642552,MINCULTURA,Prestar servicios profesionales para el apoyo a la coordinación del Grupo de Divulgación y Prensa; en la elaboración de estrategias y planes de medios para la divulgación de los planes; programas; proyectos; convocatorias a medios de comunicación y eventos del Ministerio en los medios de comunicació,Prestación de servicios,Mujer,86.184,73.11202360787905,271 Dia(s),0.15167521108466706,1.1787937981614316,https://community.secop.gov.co/Public/Tendering/OpportunityDetail/Index?noticeUID=CO1.NTC.5931407&isFromPublicArea=True&isModal=true&asPopupView=true,0.3359661102294922
199072,RNEC,Prestar el servicio de monitoreo en medios de comunicación internacionales; nacionales; regionales; locales y comunitario para hacer seguimiento de la información que se registra en radio; prensa; televisión; revistas; portales digitales; electrónicos y redes sociales donde se referencia la Registra,Prestación de servicios,Hombre,29.988,25.311318313151187,247 Dia(s),0.155951770269735,1.1847664206577069,https://community.secop.gov.co/Public/Tendering/OpportunityDetail/Index?noticeUID=CO1.NTC.6343027&isFromPublicArea=True&isModal=true&asPopupView=true,0.32528138160705566
206005,Gobernación Norte de Santander*,Prestar los servicios de apoyo a la gestión para el cubrimiento periodistico  de las actividades que desarrolla la Gobernación de Norte de Santander y sus diferentes dependencias en medios de radiodifusión y canales digitales.,Prestación de servicios,Hombre,11.999999999999998,10.117717787403443,6 Mes(es),0.15685685104971298,1.1860382204907907,https://community.secop.gov.co/Public/Tendering/OpportunityDetail/Index?noticeUID=CO1.NTC.5703225&isFromPublicArea=True&isModal=true&asPopupView=true,0.3048466742038727
557587,CONCEJO MUNICIPAL DE YOPAL,PRESTAR LOS SERVICIOS COMO COMUNICADOR SOCIAL DEL CONCEJO MUNICIPAL DE YOPAL MEDIANTE LA PROMOCIÓN Y DIVULGACIÓN DE LAS ACTIVIDADES REALIZADAS POR LA CORPORACIÓN.,Prestación de servicios,Mujer,15.982200000000004,13.465407714861222,4 Mes(es),0.15747470843430703,1.1869079896007235,https://community.secop.gov.co/Public/Tendering/OpportunityDetail/Index?noticeUID=CO1.NTC.6471221&isFromPublicArea=True&isModal=true&asPopupView=true,0.3083963692188263
309743,MUNICIPIO DE CAQUEZA,PRESTACIÓN DE SERVICIOS PROFESIONALES PARA REALIZAR PUBLICIDAD; COMUNICACIÓN; MANEJO DE REDES SOCIALES; PRENSA Y DIFUSION DE LAS CAMPAÑAS INSTITUCIONALES QUE ADELANTE LA ADMINISTRACIÓN DEL MUNICIPIO DE CÁQUEZA CUNDINAMARCA,Prestación de servicios,Mujer,21.7,18.16896605751655,188 Dia(s),0.16272045817896086,1.1943442423363795,https://community.secop.gov.co/Public/Tendering/OpportunityDetail/Index?noticeUID=CO1.NTC.5519614&isFromPublicArea=True&isModal=true&asPopupView=true,0.32611948251724243
165580,CONCEJO MUNICIPAL DE BUCARAMANGA,PRESTAR SERVICIOS PROFESIONALES EN MEDIOS AUDIOVISUALES EN EL CONCEJO MUNICIPAL DE BUCARAMANGA,Prestación de servicios,Mujer,19.799999999999997,16.3737856856702,4 Mes(es),0.17304112698635343,1.2092499792108742,https://community.secop.gov.co/Public/Tendering/OpportunityDetail/Index?noticeUID=CO1.NTC.5559202&isFromPublicArea=True&isModal=true&asPopupView=true,0.3444684147834778
207724,GOBERNACIÓN DE CUNDINAMARCA - SECRETARÍA DE PRENSA Y COMUNICACIONES,PRESTAR SERVICIOS PROFESIONALES A LA SECRETARIA DE PRENSA Y COMUNICACIONES DESARROLLANDO ACTIVIDADES PERIODISTICAS Y DE PRODUCCION RADIAL CON EL FIN DE CONTRIBUIR A LA ESTRATEGIA DE RECONOCIMIENTO Y POSICIONAMIENTO DE LA EMISORA EL DORADO RADIO EN BUSCA DE AUMENTAR LA AUDIENCIA EN LOS MUNICIPIOS..,Prestación de servicios,Hombre,27.5,22.622409110984393,165 Dia(s),0.17736694141874937,1.2156088180125464,https://community.secop.gov.co/Public/Tendering/OpportunityDetail/Index?noticeUID=CO1.NTC.6395127&isFromPublicArea=True&isModal=true&asPopupView=true,0.3437536954879761
445645,ALCALDIA SAN PABLO DE BORBUR,PRESTACIÓN DE SERVICIOS PROFESIONALES Y DE APOYO A LA GESTIÓN COMO COMUNICADOR SOCIAL PARA LA GESTION; SOSTENIMIENTO Y CRECIMIENTO DE LOS CONTENIDOS PUBLICADOS EN REDES SOCIALES Y EL DESARROLLO DE PIEZAS PUBLICITARIAS Y CONTENIDOS AUDIOVISUALES DEL MUNICIPIO DE SAN PABLO DE BORBUR 2024,Prestación de servicios,No Definido,40.739999999999995,33.50820982511645,315 Dia(s),0.17751080448904133,1.215821442345836,https://community.secop.gov.co/Public/Tendering/OpportunityDetail/Index?noticeUID=CO1.NTC.5617846&isFromPublicArea=True&isModal=true&asPopupView=true,0.341308057308197
195798,MUNICIPIO DE BUCARAMANGA,"PRESTAR SERVICIOS DE APOYO A LA GESTION PARA LA PRODUCCION;
PUBLICACION Y DIVULGACION DE MATERIAL AUDIOVISUAL DEL
CUMPLIMIENTO DE LAS METAS DE LA SECRETARIA DE INFRAESTRUCTURA
POR TODOS LOS MEDIOS DE COMUNICACIÓN TRADICIONALES Y
DIGITALES",Prestación de servicios,Hombre,20.0,16.272487755557073,5 Mes(es),0.18637561222214635,1.2290683699036724,https://community.secop.gov.co/Public/Tendering/OpportunityDetail/Index?noticeUID=CO1.NTC.6434378&isFromPublicArea=True&isModal=true&asPopupView=true,0.32574722170829773
573762,MINISTERIO DEL TRABAJO NIVEL CENTRAL*/,Prestar servicios profesionales acompañando la creación; redacción; realización; preproducción; producción y posproducción de contenidos audiovisuales estratégicos que fortalezcan en medios televisivos; radiales y digitales la comunicación de la política pública de IVC; a las audiencias interna y ex,Prestación de servicios,No Definido,104.5465,84.77354923191321,307 Dia(s),0.18913068125749583,1.2332443426898918,https://community.secop.gov.co/Public/Tendering/OpportunityDetail/Index?noticeUID=CO1.NTC.5738010&isFromPublicArea=True&isModal=true&asPopupView=true,0.3895474076271057
94375,PERSONERIA MUNICIPAL DE YUMBO,PRESTAR LOS SERVICIOS DE APOYO COMO TECNOLOGO EN PRODUCCIÓN DE MEDIOS AUDIOVISUALES DIGITALES PARA EL FUNCIONAMIENTO DE LAS ACTIVIDADES ADMINISTRATIVAS Y DE GESTIÓN DEL PROCESO GESTIÓN DE COMUNICACIÓN Y DIVULGACIÓN PUBLICA DE LA PERSONERÍA MUNICIPAL DE YUMBO,Prestación de servicios,Hombre,17.1402,13.7882630892931,195 Dia(s),0.19555996491913166,1.2431007364016542,https://community.secop.gov.co/Public/Tendering/OpportunityDetail/Index?noticeUID=CO1.NTC.6171513&isFromPublicArea=True&isModal=true&asPopupView=true,0.3045191168785095
565587,ALCALDIA MUNICIPIO DE APARTADO,PRESTACIÓN DE SERVICIOS PARA LA GENERACIÓN DE CONTENIDO AUDIOVISUAL E INFORMATIVO EN LA OFICINA DE COMUNICACIONES DE LA ALCALDÍA DE APARTADÓ,Prestación de servicios,Hombre,27.0,21.693331051993717,9 Mes(es),0.19654329437060308,1.2446221345761732,https://community.secop.gov.co/Public/Tendering/OpportunityDetail/Index?noticeUID=CO1.NTC.5798932&isFromPublicArea=True&isModal=true&asPopupView=true,0.3010888993740082
113508,PERSONERÍA MUNICIPAL DE VALLEDUPAR,PRESTACIÓN DE SERVICIOS PROFESIONALES DE UN COMUNICADOR SOCIAL PARA LA PROMOCIÓN; DIFUSIÓN; CUBRIMIENTO   Y ACOMPAÑAMIENTO COMUNICACIONAL y PERIODISTICO DE TODA LA INFORMACIÓN Y LOS PROGRAMAS Y/O PROYECTOS QUE SE GENERAN U ORGANICE LA PERSONERÍA MUNICIPAL DE VALLEDUPAR.,Prestación de servicios,Hombre,25.0,20.019487715685823,10 Mes(es),0.19922049137256706,1.2487832033989466,https://community.secop.gov.co/Public/Tendering/OpportunityDetail/Index?noticeUID=CO1.NTC.5645749&isFromPublicArea=True&isModal=true&asPopupView=true,0.3300648629665375
304268,SECRETARÍA DISTRITAL DE MOVILIDAD,PRESTAR SERVICIOS PROFESIONALES ESPECIALIZADOS A LA SECRETARIA DISTRITAL DE MOVILIDAD PARA APOYAR LA CONSTRUCCION SEGUIMIENTO Y REPORTE DE LAS ESTRATEGIAS COMUNICACIONALES ENCAMINADAS A DIVULGAR LA INFORMACION A TRAVES DE LOS DIFERENTES MEDIOS MASIVOS DE COMUNICACION DE PLANES PROGRAMAS Y PROYECTOS,Prestación de servicios,No Definido,60.18499999999998,48.06853199655528,5 Mes(es),0.2013203955046059,1.2520665287700694,https://community.secop.gov.co/Public/Tendering/OpportunityDetail/Index?noticeUID=CO1.NTC.6745583&isFromPublicArea=True&isModal=true&asPopupView=true,0.30957838892936707
133426,ALCALDIA MUNICIPAL DE CHIA,PRESTACIÓN DE SERVICIOS DE APOYO A LA GESTIÓN EN LA OFICINA ASESORA DE COMUNICACIÓN; PRENSA Y PROTOCOLO; APOYANDO EL MANEJO DE PLATAFORMAS DE STREAMING; TRANSMISIONES EN VIVO Y CANALES DE EMISIÓN DE CONTENIDOS AUDIOVISUALES CON EL FIN DE VISUALIZAR LA GESTIÓN DE LA ALCALDÍA MUNICIPAL DE CHÍA,Prestación de servicios,Hombre,27.95,22.308151180719296,195 Dia(s),0.20185505614600013,1.2529052620083054,https://community.secop.gov.co/Public/Tendering/OpportunityDetail/Index?noticeUID=CO1.NTC.6163249&isFromPublicArea=True&isModal=true&asPopupView=true,0.31849348545074463
42561,SECRETARIA GENERAL Y DE CERCANIA AL CIUDADANO,PRESTAR LOS SERVICIOS PROFESIONALES PARA ADELANTAR LABORES PERIODÍSTICAS EN EL SISTEMA INFORMATIVO DE LA EMISORA EL DORADO RADIO; LIDERADA POR LA SECRETARÍA DE PRENSA Y COMUNICACIONES DE CUNDINAMARCA.,Prestación de servicios,Mujer,36.016000000000005,28.657125592385267,4 Mes(es),0.20432236804794363,1.2567903882715343,https://community.secop.gov.co/Public/Tendering/OpportunityDetail/Index?noticeUID=CO1.NTC.5985515&isFromPublicArea=True&isModal=true&asPopupView=true,0.3074057698249817
406466,ALCALDIA MUNICIPAL DE VALLEDUPAR,PRESTACIÓN DE SERVICIOS PROFESIONALES DE UN COMUNICADOR SOCIAL-PERIODISTA; QUE BRINDE ACOMPAÑAMIENTO EN EL CUBRIMIENTO; REDACCIÓN DE COMUNICADOS DE PRENSA; PUBLICACIÓN DE CONTENIDOS EN REDES SOCIALES Y DIFUSION DE LAS INFORMACIONES QUE SE GENERAN DE LOS EVENTOS Y ACCIONES DE GOBIERNO EN EL MUNICIPIO,Prestación de servicios,Mujer,23.999999999999996,19.07113405459757,6 Mes(es),0.20536941439176773,1.2584464002660711,https://community.secop.gov.co/Public/Tendering/OpportunityDetail/Index?noticeUID=CO1.NTC.5777267&isFromPublicArea=True&isModal=true&asPopupView=true,0.339849054813385
522465,MUNICIPIO DE ENVIGADO,PRESTACIÓN DE SERVICIOS DE APOYO PARA LA EDICIÓN Y POSTPRODUCCIÓN DEL MATERIAL AUDIOVISUAL REQUERIDO POR LA OFICINA ASESORA DE COMUNICACIONES PARA LA ELABORACIÓN DE VIDEOS; CONTENIDOS DIGITALES Y REGISTROS DE EVENTOS DE LA ALCALDÍA DE ENVIGADO.,Prestación de servicios,Hombre,38.201296,30.246143201021937,329 Dia(s),0.20824300827328115,1.2630137914148762,https://community.secop.gov.co/Public/Tendering/OpportunityDetail/Index?noticeUID=CO1.NTC.5473931&isFromPublicArea=True&isModal=true&asPopupView=true,0.32943278551101685
524861,FONDO UNICO DE TECNOLOGÍAS DE LA INFORMACIÓN Y LAS COMUNICACIONES,20200521499 Prestar servicios profesionales al Grupo Interno de Trabajo de Fortalecimiento al Sistema de Medios Públicos brindando soporte técnico en la validación de los contenidos audiovisuales y sonoros en las diferentes etapas de las convocatorias adelantadas por el grupo de medios públicos que,Prestación de servicios,No Definido,72.09859999999999,56.979519536163465,280 Dia(s),0.20970005608758738,1.2653423648867523,https://community.secop.gov.co/Public/Tendering/OpportunityDetail/Index?noticeUID=CO1.NTC.5868011&isFromPublicArea=True&isModal=true&asPopupView=true,0.3368940055370331
316721,MUNICIPIO DE BUCARAMANGA,PRESTAR SERVICIOS PROFESIONALES COMO COMUNICADORA SOCIAL Y PERIODISTA CON ESPECILIZACION EN EL MARCO DEL PROYECTO DENOMINADO: IMPLEMENTACIÓN DE ESTRATEGIAS DE COMUNICACIÓN Y PUBLICIDAD EN LA ALCALDIA BUCARAMANGA,Prestación de servicios,No Definido,31.4,24.730347299664718,157 Dia(s),0.21240932166672868,1.2696950681491523,https://community.secop.gov.co/Public/Tendering/OpportunityDetail/Index?noticeUID=CO1.NTC.6425849&isFromPublicArea=True&isModal=true&asPopupView=true,0.3333807587623596
770815,INSTITUTO DE DEPORTES Y RECREACION DE MEDELLIN,PRESTAR LOS SERVICIOS DE APOYO A LA GESTIÓN COMO AUDIOVISUAL - PROFESIONAL 4; EN LA PREPRODUCCIÓN; PRODUCCIÓN Y PUBLICACIÓN DE CONTENIDOS AUDIOVISUALES; MULTIMEDIALES Y DIGITALES; DESARROLLADOS POR LA OFICINA ASESORA EN COMUNICACIONES DEL INDER DE MEDELLÍN.,Prestación de servicios,Hombre,31.317,24.628409162886932,150 Dia(s),0.21357699770453964,1.2715803035785294,https://community.secop.gov.co/Public/Tendering/OpportunityDetail/Index?noticeUID=CO1.NTC.6482143&isFromPublicArea=True&isModal=true&asPopupView=true,0.3030296564102173
33972,ALCALDÍA MUNICIPAL DE SOPO,"PRESTACIÓN DE SERVICIOS PROFESIONALES PARA BRINDAR ACOMPAÑAMIENTO EN EL
PROCESO DE GENERACIÓN DE CONTENIDO AUDIOVISUAL; EDICIÓN Y PUBLICACIÓN EN
LOS DIFERENTES MEDIOS DE COMUNICACIÓN DE LA ADMINISTTACIÓN MUNICIPAL DE
SOPÓ.",Prestación de servicios,Hombre,29.9,23.497782021295993,10 Mes(es),0.214121002632241,1.2724605229932633,https://community.secop.gov.co/Public/Tendering/OpportunityDetail/Index?noticeUID=CO1.NTC.5731581&isFromPublicArea=True&isModal=true&asPopupView=true,0.38806381821632385
860533,ALCALDIA DE HONDA,CONTRATAR LA PRESTACION DE SERVICIOS PROFESIONALES EN CINE Y TELEVISION PARA LA PRODUCCION; REALIZACION; EDICION Y APOYO AUDIOVISUAL DE LAS PIEZAS PUBLICITARIAS PARA LA COMUNICACIÓN Y DIFUSION EN LAS REDES SOCIALES DE TODOS LOS PROGRAMAS Y SERVICIOS DE LA ALCALDIA MUNICIPAL,Prestación de servicios,Hombre,30.974999999999998,24.31417019366222,300 Dia(s),0.21503889608838667,1.2739484733916193,https://community.secop.gov.co/Public/Tendering/OpportunityDetail/Index?noticeUID=CO1.NTC.5761750&isFromPublicArea=True&isModal=true&asPopupView=true,0.4032024145126343
166148,GOBERNACION DE SUCRE,"PRESTACION DE SERVICIOS DE APOYO A LA GESTÓN DE UN TECNICO
PROFESIONAL EN PUBLICIDAD PUBLICIDD Y DISEÑO PUBLICITARIO PARA BRINDAR
APOYO A LA SECRETARIA DE COMUNICACIONES DE LA GOBERNACIÓN DE SUCRE.",Prestación de servicios,Hombre,16.499999999999996,12.93502936883711,5 Mes(es),0.21605882613108404,1.2756059170419483,https://community.secop.gov.co/Public/Tendering/OpportunityDetail/Index?noticeUID=CO1.NTC.5845584&isFromPublicArea=True&isModal=true&asPopupView=true,0.31866371631622314
212819,GOBIERNO DEPARTAMENTAL,CONTRATAR LA PRESTACION DE SERVICIOS PROFESIONALES DE UN COMUNICADOR SOCIAL - PERIODISTA PARA BRINDAR APOYO A LA DIRECCION DE PRENSA Y COMUNICACIONES DE LA GOBERNACIÓN DE TOLIMA.,Prestación de servicios,Mujer,31.8,24.884118627685826,180 Dia(s),0.2174805462991879,1.2779235011610832,https://community.secop.gov.co/Public/Tendering/OpportunityDetail/Index?noticeUID=CO1.NTC.5749434&isFromPublicArea=True&isModal=true&asPopupView=true,0.3085940182209015
743632,ALCALDÍA MUNICIPAL DE SOPO,PRESTACIÓN DE SERVICIOS PROFESIONALES COMO COMUNICADOR SOCIAL; PARA LA PRESENTACIÓN DE LOS EVENTOS Y APOYO EN LOS CONTENIDOS EN PARRILLA DE PROGRAMACIÓN Y LA RADIODIFUSIÓN SONORA DE LA EMISORA DE INTERÉS PÚBLICO DEL MUNICIPIO DE SOPO.,Prestación de servicios,Hombre,24.505,19.16064208215674,195 Dia(s),0.2180925491876457,1.2789237383031211,https://community.secop.gov.co/Public/Tendering/OpportunityDetail/Index?noticeUID=CO1.NTC.6262728&isFromPublicArea=True&isModal=true&asPopupView=true,0.30291762948036194
732930,FISCALÍA GENERAL DE LA NACIÓN NIVEL CENTRAL.,PRESTAR EL SERVICIO DE MONITOREO DIARIO; CLASIFICACION; MEDICION Y ANALISIS DE LA INFORMACION GENERADA; REGISTRADA; EMITIDA Y PUBLICADA DE LA FISCALIA GENERAL DE LA NACION; EN PRENSA ESCRITA; RADIO; TELEVISION; PORTALES DE INTERNET Y REDES SOCIALES A NIVEL NACIONAL,Prestación de servicios,No Definido,62.04263299999999,48.43683033965045,521 Dia(s),0.21929763458539134,1.280897873889403,https://community.secop.gov.co/Public/Tendering/OpportunityDetail/Index?noticeUID=CO1.NTC.7166851&isFromPublicArea=True&isModal=true&asPopupView=true,0.3204248547554016
185928,PERSONERIA DE CAJICA,SERVICIOS PROFESIONALES PARA APOYAR EL FORTALECIMIENTO DE LA VISIBILIDAD Y RECONOCIMIENTO DE LA PERSONERÍA MUNICIPAL A TRAVÉS DE DIVERSOS MEDIOS DE COMUNICACIÓN; PRENSA Y ENTIDADES PÚBLICAS Y PRIVADAS,Prestación de servicios,Hombre,36.0,28.02828352438535,6 Mes(es),0.22143656876707357,1.2844168630119301,https://community.secop.gov.co/Public/Tendering/OpportunityDetail/Index?noticeUID=CO1.NTC.5509814&isFromPublicArea=True&isModal=true&asPopupView=true,0.377982497215271
391409,INSTITUTO DISTRITAL DE SANTA MARTA PARA LA RECREACIÓN Y EL DEPORTE,PRESTACIÓN DE SERVICIOS DE APOYO A LA GESTIÓN PARA LA DIFUSIÓN Y CREACIÓN DE CONTENIDOS PARA LA PROMOCIÓN INSTITUCIONAL A TRAVÉS DE LAS REDES SOCIALES; ELABORACION DE BOLETINES Y CUBRIMIENTO DE EVENTOS DEPORTIVOS Y RECREATIVOS EN MEDIOS DE COMUNICACION,Prestación de servicios,Hombre,20.0,15.557749407500097,111 Dia(s),0.22211252962499514,1.2855329827049649,https://community.secop.gov.co/Public/Tendering/OpportunityDetail/Index?noticeUID=CO1.NTC.5812932&isFromPublicArea=True&isModal=true&asPopupView=true,0.3431221842765808
778025,ALCALDIA MUNICIPAL DE BUGA,PRESTAR LOS SERVICIOS DE ASESORIA EXTERNA EN PERIODISMO Y PAUTA PUBLICITARIA PARA APOYAR EN LA DIFUSION COMUNICACIONAL Y VISUAL DE LAS GESTIONES Y ACTIVIDADES REALIZADAS POR LA ADMINISTRACION MUNICIPAL DE GUADALAJARA DE BUGA.,Prestación de servicios,Hombre,21.0,16.17996016233774,204 Dia(s),0.22952570655534577,1.297901835931705,https://community.secop.gov.co/Public/Tendering/OpportunityDetail/Index?noticeUID=CO1.NTC.6191328&isFromPublicArea=True&isModal=true&asPopupView=true,0.33123087882995605
