,Nombre Entidad,Descripcion del Proceso,Tipo de Contrato,Género Representante Legal,Valor real,Valor Proyectado,Duración del contrato,Tamaño valor extraño,veces la predicción,URLProceso,similarity
394053,JEP,ADQUIRIR E IMPLEMENTAR LA AMPLIACIÓN DEL SISTEMA DE GESTIÓN DE MEDIOS (MEDIA) PARA LA PRODUCCIÓN PROFESIONAL DE CONTENIDOS AUDIOVISUALES EN SU FASE IV,Suministros,Otro,1742.785418,117.73066148062442,3 Mes(es),0.9324468404057852,14.803156595589329,https://community.secop.gov.co/Public/Tendering/OpportunityDetail/Index?noticeUID=CO1.NTC.6833798&isFromPublicArea=True&isModal=true&asPopupView=true,0.3056586980819702
304244,DEPARTAMENTO DE ANTIOQUIA,Realizar pauta publicitaria y estrategias de comunicación pública en los diferentes medios de comunicación; para apoyar actividades de promoción y divulgación de los proyectos y programas de la Gobernación de Antioquia,Otro,No Definido,3252.844679,203.44515251328642,299 Dia(s),0.9374562352064624,15.988804052667541,https://community.secop.gov.co/Public/Tendering/OpportunityDetail/Index?noticeUID=CO1.NTC.5956535&isFromPublicArea=True&isModal=true&asPopupView=true,0.3907912075519562
843061,INSTITUTO COLOMBIANO AGROPECUARIO - ICA,LA PRESTACIÓN DEL SERVICIO DE PREPRODUCCIÓN; PRODUCCIÓN; POSTPRODUCCIÓN Y EMISIÓN DE LOS PROGRAMAS INSTITUCIONALES PARA TELEVISIÓN; EMISIÓN DEL PROGRAMA DE RADIO Y DEMÁS PRODUCTOS AUDIOVISUALES Y RADIALES,Otro,No Definido,1917.789778,91.86147778090053,9 Mes(es),0.9521003402798925,20.876975031624617,https://community.secop.gov.co/Public/Tendering/OpportunityDetail/Index?noticeUID=CO1.NTC.5968751&isFromPublicArea=True&isModal=true&asPopupView=true,0.3038778305053711
517665,DEFENSORÍA DEL PUEBLO,Contratar la preproducción; producción; postproducción y emisión de piezas; programas; campañas audiovisuales y desarrollo de acciones y actividades de comunicación de la Defensoría del Pueblo para la promoción y divulgación de Derechos Humanos; llegando a través de diferentes medios masivos de comu,Otro,No Definido,4420.882679,186.1547989316751,270 Dia(s),0.9578919386809461,23.748421767104748,https://community.secop.gov.co/Public/Tendering/OpportunityDetail/Index?noticeUID=CO1.NTC.5903000&isFromPublicArea=True&isModal=true&asPopupView=true,0.31289273500442505
619303,PROSPERIDAD SOCIAL,Prestar por sus propios medios con plena autonomía técnica y administrativa los servicios integrales como operador de comunicaciones para la preproducción; producción; postproducción y emisión de piezas; programas y campañas audiovisuales de PROSPERIDAD SOCIAL; así como su divulgación y difusión en,Otro,No Definido,2900.0,83.8041141037599,214 Dia(s),0.9711020296193932,34.60450636599344,https://community.secop.gov.co/Public/Tendering/OpportunityDetail/Index?noticeUID=CO1.NTC.6319204&isFromPublicArea=True&isModal=true&asPopupView=true,0.3196701407432556
231413,DEPARTAMENTO DE ANTIOQUIA,Contratar una central de medios para la creación; diseño; producción; emisión y difusión de contenido audiovisual BTL; ATL y escrito para campañas de información; educación y comunicación de la Secretaría Seccional de Salud y Protección Social de Antioquia,Otro,No Definido,4598.342999999999,131.42078364637868,210 Dia(s),0.9714199694006345,34.989465687352926,https://community.secop.gov.co/Public/Tendering/OpportunityDetail/Index?noticeUID=CO1.NTC.6262933&isFromPublicArea=True&isModal=true&asPopupView=true,0.318104088306427
546580,FONDO NACIONAL DEL AHORRO S.A.,Prestar servicios integrales para la promoción; divulgación y emisión de actividades de mercadeo; publicidad; comercialización; agencia creativa y monitoreo de medios de conformidad con el plan de comunicaciones de la entidad,Decreto 092 de 2017,No Definido,12423.9812,135.83056775071228,12 Mes(es),0.9890670658974667,91.46675454380446,https://community.secop.gov.co/Public/Tendering/OpportunityDetail/Index?noticeUID=CO1.NTC.6410883&isFromPublicArea=True&isModal=true&asPopupView=true,0.36949336528778076
648643,FABRICA DE LICORES Y ALCOHOLES DE ANTIOQUIA,ORDENACIÓN Y EJECUCIÓN DE PAUTA PUBLICITARIA Y COMUNICACIÓN CORPORATIVA EN LOS DIFERENTES MEDIOS DE COMUNICACIÓN Y PUBLICIDAD EXTERIOR A NIVEL NACIONAL E INTERNACIONAL CUANDO APLIQUE.,Otro,No Definido,14476.0,142.45097859013137,11 Mes(es),0.9901595068672194,101.62092351538861,https://community.secop.gov.co/Public/Tendering/OpportunityDetail/Index?noticeUID=CO1.NTC.5664423&isFromPublicArea=True&isModal=true&asPopupView=true,0.36770203709602356
